Row,Name,Type,Accuracy,Ammo,ArmorPenetration,Availability,Cost,DamageValue,Description,Modes,Modifiers,Reach,RecoilCompensation,StandardUpgrades,Wireless,Source,Skill,SkillRow,Mounts,Container
160,"Pistol Crossbow",Bow,7,,,6R,300¥,4P,"The Sliver, as well as some of its other competing models, is designed for stealthy operation as opposed to high-damage potential. Due to the preference for stealth over force, the Sliver is most often used with Ranger Puncture Injection Bolts. These supposedly “best in the market” projectiles offer significant penetrative power to make sure whatever they’re loaded with makes its way into the target.",SS,,,,,,SR5:R&G,Archery,93,,1
161,"Harpoon Gun",Bow,5,1,-2,6R,200¥,9P,"Whether used to spear fish, defend against some of the more aggressive denizens of the oceans, or remind other sentient swimmers that what you’ve found beneath the waves belongs to you, the Aquadyne Shark can be a valuable asset. Powered by CO2 and possessing an internal magazine, the Shark doesn’t stop after just one pull of the trigger, a feature that has saved many a diver that trusted the Aquadyne brand. For the sport fisherman, the Shark features the QuickClip line system that makes setting up for the next catch faster than ever.",SS,,,,,,SR5:R&G,Archery,93,,1
162,"Aquadyne Shark-XS Harpoon Gun",Bow,5,5(m),-2,8R,800¥,9P,"Whether used to spear fish, defend against some of the more aggressive denizens of the oceans, or remind other sentient swimmers that what you’ve found beneath the waves belongs to you, the Aquadyne Shark can be a valuable asset. Powered by CO2 and possessing an internal magazine, the Shark doesn’t stop after just one pull of the trigger, a feature that has saved many a diver that trusted the Aquadyne brand. For the sport fisherman, the Shark features the QuickClip line system that makes setting up for the next catch faster than ever.",SS,,,,,,SR5:R&G,Archery,93,,1
163,"Ares Giantslayer Slingshot",Bow,7,,,,50¥,2P,"Not quite the wrist rocket you had as a kid—if David had the Giantslayer, the end result of his little tiff with Goliath wouldn’t be quite so startling. Modern materials throughout make this “kid’s toy” as deadly as any holdout and most light pistols on the market.",SS,,,,,,SR5:R&G,Archery,93,,1
164,"Dynamic Tension Bow",Bow,5,,-(Rating/4),12,"1,200¥",(Rating+2)P,"For most people, their Strength is a fixed factor. For those with magic on their side, Strength can vary dramatically. For archers that like to pump themselves up magically, a compound bow was developed with dynamic pulley adjustment that allows a variable draw strength. This bow functions similarly to a compound bow, but the Rating can be changed from 1 through 10 as a Simple Action.",,,,,,,SR5:HT,Archery,93,,1
165,"Ares Redline Laser","Exotic Laser",9,"10(c) or external source",-10,14F,"7,500¥",5P,"Featured as the weapon of Ace Holt in the Cross Point: Daedalus trideo trilogy, the Ares Redline laser pistol has been the poster child for Ares’ laser weapons program. Even though it has been on the market for a number of years the Redline has not seen many improvements or, as most folks were hoping, an increase in production volume.",SA,,,,,,SR5:R&G,"Exotic Ranged Weapon (Specific)",108,"Top, Under",1
166,"Ares Lancer MP Laser","Exotic Laser",7,"2 * 10(c) or external source",-10,18F,"16,000¥",7P,"It was inevitable with the popularity of the Redline that the MP-Laser line would get an upgrade and facelift to fit the image of a sci-fi laser rifle, ready for an alien invasion. Though unless the aliens are attacking a high-profile Ares facility or Firewatch training facility, we likely won’t see many Lancers on the front line.",SA,,,,,,SR5:R&G,"Exotic Ranged Weapon (Specific)",108,"Top, Under",1
167,"Ares Archon Heavy MP Laser","Exotic Laser",7,"External source",-10,24F,"35,000¥",10P,"Pushing the limits of the MP denotation, the Archon is Ares’ biggest personal laser system. Too heavy and awkward for most users the Archon comes standard with a bipod and a mount for either a tripod or gyro-mount. This bad boy will make anyone stand up and take notice.",SA,,,,,,SR5:R&G,"Exotic Ranged Weapon (Specific)",108,"Top, Under",1
168,"Ares Armatus","Exotic Ranged",6,10(c),-5,20F,"19,000¥",6P,"A recent experimental prototype “laser shotgun” produced by Ares, this laser weapon uses a beam splitter to fre an array of smaller lasers rather than a single cohesive beam. This weapon has been seen in limited use with Firewatch teams but has not been released for sale on the military arms market. If you are lucky enough to happen across one for sale, consider its condition to be dropped once, never fired. This weapon has the same qualities specifc to other laser weapons (p. 47, Run & Gun) including increased range penalties and power source needs. The Armatus uses shotgun ranges and can fire narrow, medium, or wide spreads like a normal shotgun.",SA,,,,,,SR5:HT,"Exotic Ranged Weapon (Specific)",108,"Top, Under",1
169,"Ares S-III Super Squirt","Exotic Ranged",3,20(c),,7R,950¥,Chemical,"This popular non-lethal weapon fires DMSO gel packs. The dimethyl sulfoxide forces the skin to absorb the chemicals the operator wishes to deliver. The attack itself causes no damage, but when the target is hit successfully, the DMSO delivers the substance directly into the target’s bloodstream as a Contact vector toxin (Toxins, Drugs, and BTLs, p. 408). The Super Squirt uses Light Pistol ranges and can accept top- and underbarrel-mounted accessories",SA,,,,,,Core,"Exotic Ranged Weapon (Specific)",108,"Top, Under, Stock, Side",1
170,"Ares Screech Sonic Rifle","Exotic Ranged",6,10(c),*,16R,"8,000¥",7S,"This is a nasty little oddball of a weapon. Though it’s called the Screech and its classified as a sonic rifle, anyone with this thing pointed at them will rarely hear a thing other then their own retching as they puke up their latest meal. This devious invention uses focused sound waves to disorient the target while not causing any real damage. Perfect for crowd control as long as the users are prepped with gas masks, since the reek of soybase vomit will fill the air this sucker is fired.",SS,,,,,,SR5:R&G,"Exotic Ranged Weapon (Specific)",108,"Top, Under, Side, Stock",1
171,Blowgun,"Exotic Ranged",8,1(ml),,4,15¥,1P,"Nope, not kidding. The blowgun has been silently neutralizing targets for hundreds of years. Especially popular with stealthy forces that like to poison their targets and then recover their goodies or finish them off once they are no longer able to fight off a flea. They take a lot of skill to use and almost always include a drug or toxin on their needles. Otherwise it would just be ranged acupuncture.",SS,,,,,,SR5:R&G,"Exotic Ranged Weapon (Specific)",108,,1
172,Bola,"Exotic Ranged",Physical,,4,6,75¥,(STR+3)S,"Take a pair of rocks, tie them together with a rope. Now you have basic bolas. Take that and throw it at some thing, letting the extra centrifugal force give it some added punch. Now get fancy and try and wrap it around your target. It’s not easy, but if you hit just right it’s both a takedown and a load of pain all in one. Modern bolas aren’t rocks tied with strings; instead, they’re usually solid steel connected with wire, often with three balls instead of two. They’re a favorite weapon of hunters that prefer to take their prey alive, especially bounty hunters.",,,,,,,SR5:R&G,"Exotic Ranged Weapon (Specific)",108,,1
173,"Fichetti Pain Inducer","Exotic Ranged",3,Special,,11R,"5,000¥",Special,"For a non-lethal weapon, the Fichetti Pain Inducer is not very humane. It makes someone feel like they are in a microwave, roasting from the inside out. Treat this as a toxin attack with a Power of 8 and a speed of Immediate. The target resists with Body + Willpower. If the modified Power exceeds the target’s Mental limit, the target must spend his next Action Phase doing whatever it takes to run away from the pain. The attacker can continue to hold her beam on a target with a Complex Action unless the game-master deems the target has dodged away or found cover. If the target cannot get out of the beam, he is incapacitated with pain, suffering a dice pool modifier equal to the modified Power on all tests for as long as the beam is trained on him.",SS,,,,,"The Pain Inducer recharges by induction at a rate of 1 charge per hour.",Core,"Exotic Ranged Weapon (Specific)",108,"Top, Under, Side, Stock",1
174,"Flame Bracer","Exotic Ranged",4,2(c),-6,8F,775¥,6P(fire),"This gizmo was invented by a mage who favored the Shape Fire spell but could never find a ﬂame when he needed it. On a critical glitch you hit yourself with the ﬂame. This weapon uses the Exotic Ranged Weapon skill.",SS,,,,,,SR5:HT,"Exotic Ranged Weapon (Specific)",108,"Top, Under, Barrel, Side, Internal, Stock",1
175,"FN-AAL Gyroject Pistol","Exotic Ranged",5,10(c),-2,12F,"2,000¥",10P,"Once advertised as a favorite of the British Special Boat Squadron, FN has increased their market audience to most of the marine-based special operations forces around the world. The gun fires miniature 6mm rockets that explode on impact—an effect that, underwater, is even worse than in the air.",SA,,,,,,SR5:R&G,"Exotic Ranged Weapon (Specific)",108,"Top, Barrel, Side, Stock",1
176,"Grapple gun","Exotic Ranged",3,1(ml),-2,8R,500¥,7S,"This gun can shoot a grappling hook and attached rope, using Light Crossbow ranges. It comes equipped with an internal winch to pull back the grapple (or pull up small loads). Use the Exotic Ranged Weapon skill to shoot it. Micro rope can support a weight of up to 100 kilograms; standard and stealth ropes can support a weight of up to 400 kilograms.",SS,,,,,,Core,"Exotic Ranged Weapon (Specific)",108,"Top, Under, Barrel, Side, Internal, Stock",1
177,"Gun Cane, Knockoff","Exotic Ranged",5,,,6R,150¥,9P,"Where fashion meets defense, this single-shot weapon is a fashion accessory with both form and function. Designed to look just like Mortimer’s regular line of dress canes, the Trafalger tag goes on any of the gun canes no matter what they look like.",SS,,,,,,SR5:R&G,"Exotic Ranged Weapon (Specific)",108,"Top, Under, Barrel, Side, Internal, Stock",1
178,"Gun Cane, Trafalgar","Exotic Ranged",6,1(b),,9R,750¥,7P,"Where fashion meets defense, this single-shot weapon is a fashion accessory with both form and function. Designed to look just like Mortimer’s regular line of dress canes, the Trafalger tag goes on any of the gun canes no matter what they look like.",SS,,,,,,SR5:R&G,"Exotic Ranged Weapon (Specific)",108,"Top, Under, Barrel, Side, Internal, Stock",1
179,"Monofilament Bola","Exotic Ranged",Physical,,-0.5,18F,"4,000¥",(STR+3)S/12P,"If getting tangled up by a pair of metal balls on a metal wire wasn’t bad enough, imagine if that wire was a monofilament line. There’s very little intention to capture and much more to harm, though the company tag line is suppression through intimidation, claiming they wrap and prevent escape by the threat of increased risk of harm.",,,,,,,SR5:R&G,"Exotic Ranged Weapon (Specific)",108,,1
180,Net,"Exotic Ranged",Physical-2,,,6,350¥,,"There always seemed to be no more embarrassing gladiatorial death than to be trapped in a net and then poked to death. I think the fact that the gladiators who fought with nets were the lowliest of the low makes it even worse. But these days it doesn’t matter. If it works, use it. The net makes a great way to slow an opponent and provide an advantage, and isn’t that what life is always about—getting the advantage?",,,,,,,SR5:R&G,"Exotic Ranged Weapon (Specific)",108,"Top, Under, Barrel, Side, Internal, Stock",1
181,"Net Gun, Basic","Exotic Ranged",5,4(b),,9,750¥,,,SS,,,,,,SR5:R&G,"Exotic Ranged Weapon (Specific)",108,"Top, Under, Barrel, Side, Internal, Stock",1
182,"Net Gun, XL","Exotic Ranged",5,2(b),,9,"1,000¥",,"This weapon comes in two models, the basic and the XL. The basic is designed for metahumans, except for trolls, and smaller critters; while the XL is intended for trolls and other larger creatures.",SS,,,,,,SR5:R&G,"Exotic Ranged Weapon (Specific)",108,"Top, Under, Barrel, Side, Internal, Stock",1
183,"Parashield Dart Pistol","Exotic Ranged",5,5(c),,4R,600¥,"as Drug/Toxin","The industry standard dart pistol, this fires injection dar ts (p. 434) with narcoject or another payload. The Parashield dar t pistol uses Heavy Pistol ranges and can take top-mounted accessories.",SA,,,,,"The dart reports whether or not it has struck home and successfully injected. It may also report any gross physical anomalies in the target’s tissue, although its medical sensors are not very sophisticated (Device Rating of 1 for the dart).",Core,"Exotic Ranged Weapon (Specific)",108,"Top, Side, Stock",1
184,"Parashield Dart Rifle","Exotic Ranged",6,6(m),,6R,"1,200¥","as Drug/Toxin","Originally designed to non-lethally take down large game animals at long ranges, the Parashield dart rifle uses compressed air cartridges to fire injection darts. This weapon includes a top-mounted imaging scope. It uses sporting rifle ranges and can mount top and underbarrel accessories.",SA,,,,,"The dart reports whether or not it has struck home and successfully injected. It may also report any gross physical anomalies in the target’s tissue, although its medical sensors are not very sophisticated (Device Rating of 1 for the dart).",Core,"Exotic Ranged Weapon (Specific)",108,"Top, Under, Side, Stock",1
185,"Shiawase Blazer","Exotic Ranged",6,4(c),-6,16F,"2,200¥",10P,"Handheld flaming death! The Blazer is small and easily portable. Used heavily during the Az-Am War to root out Amazonian guerillas, the Blazer has found its way into the standard arsenal of many mercenary and special operations units around the world.",SA/BF/FA,,,,,,SR5:R&G,"Exotic Ranged Weapon (Specific)",108,"Top, Under, Barrel, Side, Internal, Stock",1
186,"Shiawase Arms Incinerator","Exotic Ranged",4,6(c),-6,12F,"10,000¥",12P,"A recent release from Shiawase, the Incinerator is the first personal incendiary device to utilize advanced polymers in nearly every aspect of its construction. The advanced materials limited the thermal stress placed on the ignition chamber as well as ensuring the operator suffers limited discomfort from the intense heat. The recommended fuel mixture ensures complete combustion; field-expedience mixtures are still possible, but less efficient.",SS,,,,"Powered SlideMount (Rating 1), Reduced Weight",,SR5:GH3,"Exotic Ranged Weapon (Specific)",108,Under,1
187,"Shiawase Arms Simoom","Exotic Ranged",5,6(ml),,14R,"1,500¥",6P,"Combining the best of offense and defense, this set of forearm guards (p. 73, Run & Gun) offers +1 Armor and has a built in light pistol “Magazine Barrel” on the dominant arm’s guard. Firing is a Complex Action. The magazine barrel holds 6 shots that can be fred individually or all at once as full auto fire. The Simoom uses pistol ranges. Full Auto fire takes a –2 penalty from recoil. The offhand guard has one capacity slot that stores a spare barrel magazine (nonfring) standard but can be repurposed with other equipment. The Concelability modifer to hide the true function of the bracer is –4. Wireless bonus: Firing is a Simple Action",SA/FA,,,,,,SR5:HT,"Exotic Ranged Weapon (Specific)",108,"Top, Under, Barrel, Side, Internal, Stock",1
188,"Shooting Bracer","Exotic Ranged",5(6),1(b),,10R,"1,250¥",7P,,SS,,,,,,SR5:R&G,"Exotic Ranged Weapon (Specific)",108,"Top, Under, Barrel, Side, Internal, Stock",1
189,"Throwing Syringe","Exotic Ranged",Physical,,-2,6F,"1,500¥",(STR-2)P,"Originally developed by a street doc who was also a throwing adept, this weapon quickly found fans with assassins due to its ability to deal deadly attacks in an easily concealable package. These aerodynamic throwing needles have an internal compressed reservoir with an inertial trigger. When the darts strike a target, they inject any liquid they contain into the target. If the syringe does not penetrate the armor and the liquid is not contact vector, the target is not affected by the liquid (see Injection Darts, p. 434, SR5). A character can ready (Agility / 2) of these syringes with one Ready Weapon action. Wireless bonus: If all the Throwing Syringes you throw in a Combat Turn have wireless and you have a smartlink system, each syringe you throw receives a +1 dice pool bonus per syringe thrown that Combat Turn at your current target, as the syringes adjust for wind and other atmospheric conditions. So you’d get no bonus on the frst throw, +1 on the second throw, and +2 on the third, etc. (assuming you aimed all three syringes at the same target. If you didn’t then no bonus).",,,,,,,SR5:HT,"Exotic Ranged Weapon (Specific)",108,"Top, Under, Barrel, Side, Internal, Stock",1
190,"Monofilament Whip","Exotic Melee",5(7),,-8,12F,"10,000¥",12P,"Iconic. Terrifying. Deadly. Few weapons on the street are more feared. This monofilament line can cut through bone and armor like hot butter. The line extends out to two meters, and retracts into the weapon`s handle when not in use. The whip action, the weighted tip, and the deadly thread of monofilament line itself make this weapon a potential danger to it`s wielder.",,,2,,,"The whip can be readied with a Free Action, rather than a Simple Action. The whip`s built-in safety system retracts automatically instead of getting you entangled on a glitch. Accuracy increased by 2.",Core,"Exotic Melee Weapon (Specific)",107,,1
191,"Monofilament Chainsaw","Exotic Melee",3,,-6,8,500¥,8P,"The top of each chain segment on this portable motorized saw is covered with monofilament wire. Ideal for cutting through trees, doors, and other immovable objects. A monofilament chainsaw is too unwieldy to make a good melee weapon (use Exotic Melee Weapon skill). When used against barriers, double the monofilament chainsaw’s Damage Value of 8P.",,,1,,,,Core,"Exotic Melee Weapon (Specific)",107,,1
192,Garrote,"Exotic Melee",5,,-6,,50¥,(STR+4)S,"This can be as simple as a string attached to a pair of pencils but is usually a far more professional tool. The garrote is a handheld weapon designed to quietly kill via strangulation. The weapon consists of a central string, usually semiflexible wire of some sort, attached to a pair of handles used to pull the weapon tight once it is wrapped around a targets neck. Death is slow and unpleasant as the target usually struggles intensely, so a strong stomach and skill are both required.",,,,,,,SR5:R&G,"Exotic Melee Weapon (Specific)",107,,1
193,"Ares "Queen of Hearts" Monofilament Garrote","Exotic Melee",5,,-8,18F,"2,000¥",(STR+6)S,"Leave it to Ares to make something deadly even deadlier. The Queen of Hearts is the nickname for Ares’ monofilament garrote that will often take a head right off well before the target suffocates, though I’m certain that was part of the intended design. Other megacorps have copied the design, but Ares is by far the biggest name out there.",,,,,,,SR5:R&G,"Exotic Melee Weapon (Specific)",107,,1
194,Chakram,"Exotic Melee",4,,,8R,750¥,(STR)P,"Use Shuriken range and Skill Exotic Melee Weapon (Chakram)",,,,,,,SR5:R&G,"Exotic Melee Weapon (Specific)",107,,1
195,Bullwhip,"Exotic Melee",6,,3,6,100¥,(STR+1)P,"Whether it’s redirecting bulls, snagging wrists, or lashing infidels, the whip has seen an interesting history as a tool, a showpiece, a torture device, and a weapon.This versatility is both its greatest asset and its biggest detriment. The training that is needed to use this weapon is very specific, but a truly skilled individual can perform feats with this item unmatched by any other weapon.",,,2,,,,SR5:R&G,"Exotic Melee Weapon (Specific)",107,,1
196,"Ash Arms Combat Chainsaw","Exotic Melee",5,,-4,6R,"2,000¥",8P,,,,1,,,,SR5:R&G,"Exotic Melee Weapon (Specific)",107,,1
197,"Ash Arms Monofilament Chainsaw","Exotic Melee",5,,-8,8R,"7,500¥",12P,"Monofilament makes everything better or so Ash Arms would like us to believe. While the civilian model is actually used for cutting things like concrete and sculpting stone, that is just never enough. Ash has retooled the monofilament cousin of the standard chainsaw as well and made it into a unique weapon that has probably cut off more limbs from brain-dead wielders than their intended victims. But boy is a successful hit awesome.",,,1,,,,SR5:R&G,"Exotic Melee Weapon (Specific)",107,,1
198,"Collapsible Scythe","Exotic Melee",5,,-2,16R,"2,350¥",(STR+2)P,"Nothing brings the terror of your imminent demise to a peak quite the same way as a shadowy figure wielding a scythe closing in on you. The progenitor of this weapon was a female assassin who goes by the name Keres. There have been a few copycats since, but none as skilled or successful. This weapon is custom made and is essentially a telescoping staff with a Smartsteel blade fused to one end. When collapsed, the staff part compresses together with a telescopic design, and the blade coils inside the end of the shaft. Collapsing or extending the scythe is a Complex Action. When collapsed, the scythe is the same size as a club or baton (0 Concealability modifer) and if inspected noticing the coiled blade can be diffcult (-4 Concealability Modifer). Wireless bonus: Collapsing or extending the scythe is a Simple Action.",,,2,,,,SR5:HT,"Exotic Melee Weapon (Specific)",107,,1
199,Knucks,Other,Physical,,,2R,100¥,(STR+1)P,"These may be traditional fist-load weapons like brass knuckles, or modern Hardliner Gloves with a thin layer of densiplast located the knuckles and the edge of the hand. Either way they substantially boost the impact of a punch, making it potentially deadly.",,,,,,,Core,"Unarmed Combat",106,,1
200,"Shock Gloves",Other,Physical,,-5,6R,550¥,8S(e),"These electrically insulated gloves have a wire mesh that discharges electric current with a punch or a simple touch. The gloves deal Electricity damage and are good for ten charges before they need to be plugged in and recharged (at a rate of one charge per ten seconds).",,,,,,"The shock gloves recharge by induction, regaining one charge per full hour of wireless-enabled time.",Core,"Unarmed Combat",106,,1
201,"Plasteel Toe Boots",Other,Physical,,,2,200¥,(STR+1)P,"Common safety wear for most dangerous jobs, these also do for your feet what knucks do for your hands (meaning kick attacks deal physical damage). These boots are used by corp security and gangers alike. While highly protective, they are too big and clunky to be helpful while being stealthy. Auditory Perception Tests against you receive a +1 dice bonus.",,,,,,,Core,"Unarmed Combat",106,,1
202,Club,Clubs,4,,,,30¥,(STR+3)P,"The weapon they named the skill after. The stats represent a range of objects, including an axe handle, baseball bat, wrench, crowbar, a tire iron, and a two-by-four with a rusty nail in it. There is a price listed, but it`s not overly difficult to find one for free if you know where to look.",,,1,,,,Core,Clubs,94,,1
203,"Extendable Baton",Clubs,5,,,4,100¥,(STR+2)P,"The telescoping club can be collapsed, and it can be extended with a sharp flick of the wrist or a wireless signal. When retracted, it`s more easily concealed.",,,1,,,"Readying the extendable baton is a Free Action instead of a Simple Action.",Core,Clubs,94,,1
204,Sap,Clubs,5,,,2,30¥,(STR+2)P,"Also called a blackjack, this is a small, springy club, or a flat piece of iron in a flexible leather covering. It’s specially designed for concealment.",,,,,,,Core,Clubs,94,,1
205,Staff,Clubs,6,,,3,100¥,(STR+3)P,"Also called a blackjack, this is a small, springy club, or a flat piece of iron in a flexible leather covering. It`s specially designed for concealment.",,,2,,,,Core,Clubs,94,,1
206,"Stun Baton",Clubs,4,,-5,6R,750¥,9S(e),"A standard riot-control weapon, viewed as a tool and symbol of corporate-government oppressors but pragmatically useful to runners. It has ten charges and regains one charge per ten seconds when plugged in.",,,1,,,"The stun baton recharges by induction, regaining one charge per full hour of wireless-enabled time.",Core,Clubs,94,,1
207,"Telescoping Staff",Clubs,4,,,4,350¥,(STR+2)P,"This is a metal and composite staff that can telescope down to a reasonable size, one that can be concealed about as easily as a stun baton or a sword. It can be extended and locked in place by whirling it at the correct speed and angle and twisting the grip, or via a wireless signal.",,,2,,,"Extending the telescoping staff is a Free Actions instead of a Simple Action.",Core,Clubs,94,,1
208,"Nemesis Arms Maul Stun Staff",Clubs,6,,-5,8R,"1,000¥",9S(e),"Double-sided zapping power! The stun staff is basically a staff with stun batons on each end. They’re rather large and a bit ugly but they look quite intimidating in the hands of the guards at Shiawase HQ.",,,2,,,,SR5:R&G,Clubs,94,,1
209,"Combat Axe",Blades,4,,-4,12R,"4,000¥",(STR+5)P,"A two-handed tungsten-alloy monster, available single- or double-bladed. A hardened thrusting point can be concealed, spring-loaded, in the handle. While it may seem barbaric or primitive, the physical augmentations of 2075 can make an old-school weapon like a combat axe even deadlier than a firearm in the right hands. So go ahead, go medieval.",,,2,,,,Core,Blades,95,,1
210,"Combat Knife",Blades,6,,-3,4,300¥,(STR+2)P,"A long, KA-BAR-style fighting knife with a blacked-out blade and a chisel point for punching through armor.",,,,,,,Core,Blades,95,,1
211,"Forearm Snap-Blades",Blades,4,,-2,7R,200¥,(STR+2)P,"These are essentially like spurs, only they’re external—painless to install or remove. A forearm sheath conceals three blades that can be extended or retracted via wireless link or muscle movement commands.",,,,,,"Readying the forearm snap blades is a Free Action instead of a Simple Action.",Core,Blades,95,,1
