Row,Name,Type,Accuracy,Ammo,ArmorPenetration,Availability,Cost,DamageValue,Description,Modes,Modifiers,Reach,RecoilCompensation,StandardUpgrades,Wireless,Source,Skill,SkillRow,Mounts,Container
110,"Ares Crusader II","Machine Pistol",5(7),40(c),,9R,830¥,7P,"A large magazine and easy handling make the Ares Crusader II one of the most popular weapons of its class. It features an integral barrel-mounted gas-vent 2 recoil compensation system and comes with an integral smartgun system.",SA/BF,"SmartGun, BARREL:Integral Gas-Vent (-2 RC)",,2,,,Core,Automatics,92,"Top, Barrel, Side, Internal, Stock",1
111,"Ceska Black Scorpion","Machine Pistol",5,35(c),,6R,270¥,6P,"This classic machine pistol provides concealable burst-fire capability. It comes equipped with an integral folding stock.",SA/BF,"Integral Folding Stock",,-1,,,Core,Automatics,92,"Top, Barrel, Side, Internal, Stock",1
112,"Onotari Arms Equalizer","Machine Pistol",4(5),12(c),,7R,750¥,7P,"A boxy machine pistol that comes from the factory with a laser sight, collapsible stock, and no iron sights for a snag-free draw. It uses cased ammunition only. This Saeder-Krupp weapon is popular with bodyguards and smaller security companies due to the ease of legally acquiring it. The strong bullpup mechanism ejects the spent shells up and to the right, making it slightly less popular with left-handed users.",BF/FA,,,-1,"Folding stock, laser sight",,SR5:R&G,Automatics,92,"Top, Barrel, Side, Internal, Stock",1
113,"PPSK-4 Collapsible Machine Pistol","Machine Pistol",5(6),30(c),,17F,"2,800¥",6P,,SA/BF,,,,"Folding stock, laser sight",,SR5:R&G,Automatics,92,"Top, Barrel, Side, Internal, Stock",1
114,"Steyr TMP","Machine Pistol",4,30(c),,8R,350¥,7P,"This lightweight polymer-frame pistol is capable of full autofire, but its light weight makes it hard to control when firing on full auto. It comes equipped with a built-in top-mounted laser sight.",SA/BF/FA,"TOP:Laser Sight",,,,,Core,Automatics,92,"Top, Barrel, Side, Internal, Stock",1
115,"Ultimax 70","Machine Pistol",5(6),15(c),,7R,800¥,6P,"Originally designed for clandestine operation, the lack of wireless systems from the firearm makes it popular for concealed carry. With an integrated laser sight and gas-vent system, it is accurate and easy to control in burst fire, but it also has the capacity to suppress opponents for a short time. Ultimax continues to have a lack of modern (read: wireless) accessories factory installed, but it offers a host of after-market modifications. While professional spies scoff at this weapon for being too large for true clandestine work, it is a nice alternative to the Ares Predator as an everyday carry piece for shadowrunners. Sometimes you just have to make everyone drop for a few seconds to make all the difference.",BF/FA,,,2,"Gas-vent 2, laser sight",,SR5:R&G,Automatics,92,"Top, Barrel, Side, Internal, Stock",1
116,"Fianchetti Military 100","Machine Pistol","5 (7)",20(c),,8R,850¥,6P,"The Military 100 offers accurate automatic fire on a large-pistol frame. Fianchetti’s engineers have integrated a full spectrum smartlink sensor into the weapon’s frame, increasing accuracy in semi-automatic and fully automatic operation. The model features a rigid, reinforced polymer frame with fully integrated diagnostic sensors linked to the smartlink’s data transfer protocols, ensuring the operator full access to their weapon’s status at all times.",SA/BF/FA,,,,Smartlink,,SR5:GH3,Automatics,92,"Top, Barrel, Side, Internal, Stock",1
117,"Cavalier Evanator","Machine Pistol","5 (6)",20(c),,8R,775¥,6P,"Utilizing the latest in projectile development, this surprisingly controllable lightweight automatic is capable of providing suppressive fire under nearly any circumstances. The slanted magazine reduces the number of jams due to magazine spring malfunction, while the integrated laser sight ensures the user sees exactly where they are aiming. The electronic firing mechanism ensures the complete combustion of the caseless propellant while reducing the perceived recoil to the firer. When fitted with its standard folding stock, the Evanator can serve as the primary weapon in a close-quarter engagement.",BF/FA,,,"1 (2)","Electronic Firing, Laser Sight, Folding Stock",,SR5:GH3,Automatics,92,"Top, Barrel, Side, Internal, Stock",1
118,"Remington Suppressor","Machine Pistol",6,15(c),-1,6R,700¥,7P,"The first modern automatic pistol design offered by Remington, the Suppressor is intended for paramilitary organizations and government agencies requiring compact automatic weapons. The design integrates a number of European stylistic elements with modern automated manufacturing quality control methods, resulting in finely tuned tolerances intended to allow the user to accurately engage any target. The weapon is shipped with a detachable sound suppressor, allowing the user to reduce their audio signature at the expense of concealment.",SA/BF,,,,"Sound Suppressor",,SR5:GH3,Automatics,92,"Top, Barrel, Side, Internal, Stock",1
119,"Ares Predator V","Heavy Pistol",5(7),15(c),-1,5R,725¥,8P,"The newest iteration of the most popular handgun in the world, especially with mercenaries and shadowrunners. Upgraded with improved ergonomics and handling features, the Ares Predator V includes a smartgun system. Some say that the Ares Predator V isn’t better than other guns in its class, but no one can argue that it has better brand recognition.",SA,Smartgun,,,,,Core,Pistols,102,"Top, Barrel, Side, Stock",1
120,"Ares Viper Silvergun","Heavy Pistol",4,30(c),4,8F,380¥,9P(f),"The sleek Slivergun pairs the undeniably winning combo of burst-fire capability and built-in sound suppression (an integral silencer, p. 432) with its large magazine capacity. It fires metal slivers that count as flechette ammunition, which is factored into the weapon’s damage code.",SA/BF,"Integral Silencer",,,,,Core,Pistols,102,"Top, Barrel, Side, Stock",1
121,"Browning Ultra-Power","Heavy Pistol",5(6),10(c),-1,4R,640¥,8P,"This venerable sidearm is the Ares Predator’s primary competition as the world’s toughest heavy pistol. It offers a built-in top-mounted laser sight and is slightly cheaper.",SA,"TOP:Integral Laser Sight",,,,,Core,Pistols,102,"Top, Barrel, Side, Stock",1
122,"Cavalier Deputy","Heavy Pistol",6,7(cy),-1,3R,225¥,7P,"With the return of Western aesthetics in fashion, the Deputy has become a choice for modern-day urban cowboys and gunslingers. Less punishing to the wrist and carrying a seven-chamber cylinder, this pistol is a choice competitor to the Ruger Super Warhawk.",SA,,,,,,SR5:R&G,Pistols,102,"Top, Barrel, Side, Stock",1
123,"Colt Government 2066","Heavy Pistol",6,14(c),-1,7R,425¥,7P,"This government-issue weapon, styled after the legendary Colt M1911a1, uses an electrically induced spark to detonate the bullet’s propellants. The removal of most moving parts from the firing mechanism gives this weapon a reputation for being exceptionally reliable.",SA,,,,,,Core,Pistols,102,"Top, Barrel, Side, Stock",1
124,"Onotari Arms Violator","Heavy Pistol",5(7),10(c),-1,7R,550¥,7P,"Constantly updated to take advantage of its reputation for using the latest integrated electronics and modern materials, this pistol has become the poster child on gun ranges everywhere as the latest for cutting-edge shootists. It comes with a smartlink, basic safe target system, and an advanced safety system (also basic), all updated constantly for a modest annual fee to Onotari Arms. A patented delayed-recoil operation, along with caseless ammunition to cut down on moving parts, help with making tight, double-tapped groups in targets.",SA,,,1,"Advanced safety system, internal smartgun, safe target system base",,SR5:R&G,Pistols,102,"Top, Barrel, Side, Stock",1
125,"PSK-3 Collapsible Heavy Pistol","Heavy Pistol",4,10(c),-1,16F,"1,050¥",8P,"Designed for the Russian UGB secret police in 2061, this pistol is able to fold up into a box barely larger than an old-style wallet when the clip is removed. Formerly a clandestine weapon made only for the UGB, information about it leaked to the public rather quickly and it became a popular choice for protection details and spy agencies around the world. Able to flip into combat mode with the press of a single button, it requires a custom silencer that must be bought separately for 700¥.",SA,,,,,,SR5:R&G,Pistols,102,"Top, Barrel, Side, Stock",1
126,"Savalette Guardian","Heavy Pistol",5(7),12(c),-1,6R,870¥,8P,"This heavily chromed street monster of a pistol has been popular in the shadows for over two decades. A heavy pistol with an integrated smartgun link, an internal micro-gyro recoil absorption system, and the option for burst firing, it’s a very reasonable weapon for an experienced owner who expects to be in heavy combat.",SA/BF,,,1,Smartlink,,SR5:R&G,Pistols,102,"Top, Barrel, Side, Stock",1
127,"Remington Roomsweeper","Heavy Pistol",4,8(m),-1,6R,250¥,7P,"This is really more of a short-barreled shotgun than a pistol. When loaded with shot rounds (flechette) rather than solid slugs, it uses Heavy Pistol ranges but shotgun rules (Shotguns, p. 180).",SA,,,,,,Core,Pistols,102,"Top, Barrel, Side, Stock",1
128,"Ruger Super Warhawk","Heavy Pistol",5,6(cy),-2,4R,400¥,9P,"This revolver is as loud as a jet liner and twice as shiny. It’s also one of the scariest handguns in the world. The cased ammo variant is popular for the sheer thrill of swinging open the cylinder gate one handed and dumping spent brass.",SS,,,,,,Core,Pistols,102,"Top, Barrel, Side, Stock",1
129,"Colt Future Frontier","Heavy Pistol",5,7(cy),-1,6R,500¥,8P,"This large-frame pistol harkens back to the days of the Wild West with its classic grip and stylistic elements. Combined with modern manufacturing techniques and metallurgy, the Future Frontier provides the discriminating shooter with the best of both worlds. A redesign of the spring mechanism allows for ease of maintenance and replacement by certified personnel, while the enlarged cylinder handles a number of nostalgic calibers and propellant loads. This is a thorough redesign of a pistol that helped expand a nation, providing yet another reason to Trust the Legend™.",SS,,,,"Melee Hardening",,SR5:GH3,Pistols,102,"Top, Barrel, Side, Stock",1
130,"Colt Manhunter","Heavy Pistol",5(6),16(c),-1,5R,700¥,8P,"Falling a distant third place between the constant advertising battle between the Savalette Guardian and the Ares Predator V, Colt has taken a different track with the latest iteration of the Manhunter. Removingt the smartlink and the associated features like electronic safety and clip ejection, and shifting everything back to traditional mechanical mechanisms with the exception of a holographic sight (p. 181). The worst a hacker can do is make you slightly less accurate with this gun and that appeals to a lot of the less technologically minded consumers. While production numbers are currently significantly smaller than its competitors, it is still readily available and a common sight on the streets.",,,,,,,SR5:HT,Pistols,102,"Top, Barrel, Side, Stock",1
131,"Lemat 2072","Heavy Pistol",5,9(cy)/1(b),-0.25,8R,"1,080¥",8P/10P(f),"This surprising offering from Krupp Arms is a throwback to the rare pistol used in the Confederacy during the Civil War. This pistol uses a double-barrel design with the cylinder rotating around a large central chamber that holds a single 20-gauge shotgun shell (most commonly loaded with a ﬂechette round). A bit large for human hands with a strong kick, it fits well in larger metahuman hands. This design combined with the Kriegfaust has some speculating that Krupp may be trying to compete with Krime for the metahuman weapons market. Switching the firing mode to fire the central shotgun chamber requires a Simple Action. This function is controlled by the custom-built ammo skip system included with this model.",,,,,,,SR5:HT,Pistols,102,"Top, Barrel, Side, Stock",1
132,"Ares Light Fire 70","Light Pistol",7,16(c),,3R,200¥,8P,"The Ares Light Fire 70 is one of the most common pistols on the market. A special barrel-mounted silencer developed exclusively for the Light Fire 70 is available that gives you an additional –1 dice pool modifier to the usual –4 (for a total of –5); this silencer costs 750¥.",SA,,,,,,Core,Pistols,102,"Top, Barrel",1
133,"Ares Light Fire 75","Light Pistol",6(8),16(c),,6F,"1,250¥",6P,"Designed based on one of the most common pistols on the market, the Light Fire is a weapon for special operators, not commonly available through legal channels. A special barrel-mounted silencer developed exclusively for the Light Fire comes attached, applying an additional –1 dice pool modifier to the modifier usually provided by silencers. In addition to its integral silencer, the Ares Light Fire 75 includes a smartgun system.",SA,"Smartgun System, Special Silencer",,,,,Core,Pistols,102,"Top, Barrel",1
134,"Beretta 201T","Light Pistol",6,21(c),,7R,210¥,6P,"This light sidearm is used by many security professionals. It is capable of burst fire. Since the 201T is classified as a light pistol without further limitations, it is quite popular with security agencies in countries where heavy pistols and machine pistols are hard to come by legally. Semi-automatic bursts using the Beretta 201T require a Simple Action. The weapon includes a detachable shoulder stock.",SA/BF,"Detachable Shoulder Stock",,-1,,,Core,Pistols,102,"Top, Barrel",1
135,"Colt America L36","Light Pistol",7,11(c),,4R,320¥,7P,"A venerable pistol with a great reputation. This basic firearm is cheap, easily concealed, and nearly ubiquitous. A perfect throwaway weapon.",SA,,,,,,Core,Pistols,102,"Top, Barrel",1
136,"Fichetti Executive Action","Light Pistol",6,18(c),,10R,300¥,7P,"“Manage your danger with Executive Action!” is the latest in a long series of taglines for this pistol, which incorporates a burst-fire option as standard. With no other truly compelling features, marketing is what this firearm mostly has going for it, but that appears to be all it needs to keep selling well.",SA/BF,,,,,,SR5:R&G,Pistols,102,"Top, Barrel",1
137,"Fichetti Security 600","Light Pistol",6(7),30(c),,6R,350¥,7P,"A light sidearm for security forces, this weapon’s highly efficient feeding mechanism allows it a thirty-round magazine. The Fichetti Security 600 comes with a detachable folding stock and laser sight.",SA,"Laser Sight, Detachable Folding Stock",,-1,,,Core,Pistols,102,"Top, Barrel",1
138,"Nitama Sporter","Light Pistol",6(7),18(c),,10R,300¥,6P,"Made from twenty different MAD-defeating components that appear to be everyday items (such as jewelry and commlink add-ons), this pistol is a choice weapon to sneak into areas illegally. It is difficult but not impossible to figure out that the disparate items are actually part of a firearm. It helps, of course, if you’ve seen one before.",SA,,,,"Laser sight",,SR5:R&G,Pistols,102,"Top, Barrel",1
139,"Shiawase Armaments Puzzler","Light Pistol",4,12(c),,14R,900¥,6P,"“A perfect pistol for the inexperienced, small-framed metahuman” is often how gun shop clerks describe this lightweight, sleek, and long-barreled pistol. With a built-in laser sight, low felt-recoil, and a small internal magazine, it is a popular home-defense weapon.  Recognize Weapon Recognizing the components of a Puzzler as belonging to a firearm when it is disassembled requires an Armorer + Logic (Mental) (3) or Perception + Intuition (Mental) (4) test. Assemble/Disassemble Assembling or disassembling the Puzzler from its concealable parts or pistol mode requires an Armorer + Logic (Mental) (6, 1 minute) Extended Test. A glitch on the test means you have to start over A critical glitch breaks one of the pieces, which will need to be repaired before the weapon can be used.",SA,,,,,,SR5:R&G,Pistols,102,"Top, Barrel",1
140,"Taurus Omni-6","Light Pistol",5(6),6(cy),0/-1,3R,300¥,6P/7P,"This reliable, rugged revolver is specially designed to handle a wide variety of ammunition. Popular with hobbyists and hand-loaders, the Omni-6 comes with some interchangeable cylinders so it can take either cased or caseless, light pistol or heavy pistol ammo. When firing light pistol rounds, the Omni-6 is semi-automatic (SA) and has a base DV of 6P, and when it fires heavy pistol ammo it has only single shot mode (SS), and a base DV of 7P and –1 AP. The Omni-6 includes an integral laser sight.",SA/SS,"Laser Sight",,,,,Core,Pistols,102,"Top, Barrel",1
141,"Colt Agent Special","Light Pistol",5,8(c),,5R,250¥,8P,"The Agent Special has been one of Colt’s bestsellers since its introduction over a century ago, and continuing updates and upgrades keep it more than relevant. The weapon’s large caliber makes it popular with shooters who prefer hitting power over range. The short barrel also reduces the round’s penetrative power, but the ability to use the same ammunition as a heavy pistol means that some organizations are turning to this steady performer to simplify their logistics.",SA,,,,,,SR5:GH3,Pistols,102,"Top, Barrel",1
142,"Cavalier Arms Adder Slivergun","Light Pistol",5,20(c),5,7F,320¥,8P(f),"Oddly enough, this gun was developed as a lightweight personal protection weapon for a mail-delivery corp. Management’s logic was that ﬂechette ammo would be more effective against aggressive dogs and similar paracritters while being less intimidating to customers. It is reminiscent of a pared-down Ares Viper Slivergun. With the modifcation of an aftermarket silencer, this gun is exceptionally handy for sneaking into a location and striking while the target’s guard is down.",SA,,,,,,SR5:HT,Pistols,102,"Top, Barrel",1
143,"Fichetti Tiffani Needler",Hold-Out,5,4(c),5,6R,"1,000¥",8P(f),"Designed to appeal to social climbers and debutantes, the Tiffani Needler is available in a wide variety of colors and styles. It also has a special color-changing coating that can be manipulated via wireless signal. This is useful to make sure your gun matches with your shoes or your handbag. The Needler can only fire flechette rounds (already factored into its damage code).",SA,,,,,,Core,Pistols,102,,1
144,"Fichetti-Tiffani Self-Defender 2075",Hold-Out,4,4(c),,3R,350¥,6P,"A purse pistol that has been updated to include the latest in fashion programming for its color-change coating, allowing it to be an excellent accessory for any outfit. Updates are available for a modest annual fee.",SS,,,,,,SR5:R&G,Pistols,102,,1
145,"Streetline Special",Hold-Out,4,6(c),,4R,120¥,6P,"Popular among society’s dregs, the Streetline Special is a small, lightweight weapon made of composite materials.",SA,,,,,,Core,Pistols,102,,1
146,"Walther Palm Pistol",Hold-Out,4,2(b),,4R,180¥,7P,"This is a classic double-barreled derringer in an over-under barrel combination. It packs a punch for its size, but on the downside it has one of the most diminutive “magazine” capacities on the marketjust one bullet per barrel. Both barrels can be fired at once as a short burst (see Not Enough Bullets, p. 180).",SS/BF,,,,,,Core,Pistols,102,,1
147,"Colt New Model Revolver",Hold-Out,6,5(cy),,4R,180¥,5P,"The New Model Revolver is Colt’s return to the small-revolver market, launched with a marketing campaign aimed at young homeowners and small security firms. The New Model is manufactured in a variety of small caliber and is largely of conventional design. The cylinder uses a simple left-side drop to allow rapid reloading with the appropriate manufacturer-approved speed loader. This model is only produced at Colt’s Connecticut facility and has largely remained rare outside of northeastern UCAS. Inside the UCAS, citizens can be proud to purchase from one of their homegrown success stories. Trust the quality of a proven manufacturer. Trust the Legend™.",SA,,,,,,SR5:GH3,Pistols,102,,1
148,"Cavalier Safeguard",Taser,5(6),6(m),-5,,275¥,6S(e),"A reliable self-defense weapon, this taser forgoes some wattage in each dart for a larger ammunition capacity, and backs that up with a top-mounted laser for increased accuracy for a less skilled shooter. It still looks sufficiently enough like a pistol to still intimidate targets who might scoff at a mere taser.",SA,,,,"Laser Sight","A successful hit informs you of the status of the target’s basic health (and Condition Monitors).",SR5:R&G,Pistols,102,"Top, Side, Stock",1
149,"Defiance EX Shocker",Taser,4,4(m),-5,,250¥,9S(e),"This heavy-duty taser fires up to 4 darts that trail wires up to 20 meters long. The wired connection to the battery allows for a more powerful shock. Most modern tasers use wireless darts, so the Defiance EX Shocker is an exception. It also features contacts that allow it to be used as a stun weapon in melee.",SS,,,,,"A successful hit informs you of the status of the target’s basic health (and Condition Monitors).",Core,Pistols,102,"Top, Side, Stock",1
150,"Tiffani-Defiance Protector",Taser,5(6),3(m),-5,,300¥,7S(e),"A sleek taser designed to accessorize well with women’s fashions, with the added benefit of geckogrip to allow it to be set anywhere that is comfortable on the body and a sleek top-mounted laser sight for quick targeting. This is a perfect choice to go with the immortal little black dress, stored under the dashboard of a car, or put next to the bed for a good night’s sleep.",SA,,,,"Laser Sight, Gecko Grip","A successful hit informs you of the status of the target’s basic health (and Condition Monitors).",SR5:R&G,Pistols,102,"Top, Side, Stock",1
151,"Yamaha Pulsar",Taser,5,4(m),-5,,180¥,7S(e),"The darts of this taser contain wireless capacitors, meaning that the Pulsar eliminates the need for cumbersome wires. As a trade-off, it is slightly less powerful than the EX Shocker, although it can fire faster. It lacks the EX Shocker’s melee contacts.",SA,,,,,"A successful hit informs you of the status of the target’s basic health (and Condition Monitors).",Core,Pistols,102,"Top, Side, Stock",1
152,"Throwing Knife/Shuriken",Throwing,Physical,,-1,4R,25¥,(STR+1)P,"A wide variety of shapes and sizes of aerodynamically balanced, specially weighted, muscle-powered throwing weapons are available, from throwing spikes to darts to kunai and shuriken. A character can ready (Agility ÷ 2) of these knives with one Ready Weapon action.",,,,,,"If all the throwing knives or shuriken you throw in a single Combat Turn are wireless and you have a smartlink system, each knife you throw receives a +1 dice pool bonus per knife thrown that Combat Turn at your current target, as the knives inform and adjust for wind and other atmospheric conditions. So you’d get no bonus on the first throw, a +1 bonus on the second throw, a +2 bonus on the third throw, etc. (assuming you aimed all three knives at the same target).",Core,"Throwing Weapons",105,,1
153,Boomerang,Throwing,Physical-1,,,4,50¥,(STR+2)P,"This is not the cute toy of your youth that you throw and try to get to come right back to you. This is the Aboriginal hunting stick that can snap the neck of an emu. Made of a wide variety of materials the modern hunting boomerang is either a heavy wood with a dull edge or a lighter composite with a sharp edge. Both are deadly in the right hands.",,,,,,"The device can provide live-feed video while in flight.",SR5:R&G,"Throwing Weapons",105,,1
154,Harpoon/Javelin,Throwing,Physical,,-1,6,125¥,(STR+3)P,"There’s a reason why the javelin was part of the original Olympics, which was a militaristic sporting competition. Metahumans have been using sharpened sticks to kill prey, and each other, for millennia. Improvements to materials technology have just allowed them to throw further, faster, and more accurately.",,,,,,,SR5:R&G,"Throwing Weapons",105,,1
155,"Urban Tribe Tomahawk",Throwing,Physical+1,,-1,4,200¥,(STR+2)P,"This is not your grandfather’s tomahawk. Made from modern composites and balanced for throwing, this modern take on the classic Native American weapon gives as much respect to its predecessors as it can while moving into the 21st century. Popular among the urban tribal street gangs, especially the First Nations in Seattle, these finely crafted killing tools can also be found on the belts of Salish Rangers and Sioux Wildcats.",,,,,,,SR5:R&G,"Throwing Weapons",105,,1
156,Bow,Bow,6,,-(Rating/4),Rating,Rating*100¥,(Rating+2)P,"This could be a traditional longbow of fiberglass or wood, or possibly a modern compound-and-pulley bow. Both are archaic and rare weapons on the streets of 2075, and both have the advantage of being hacker-proof. Reloading a bow takes a Simple Action (Ready Weapon, p. 165). Bows have ratings that indicate the minimum Strength you need to use that weapon. When attacking with a bow, a character whose Strength is less than the Rating suffers a –3 dice pool modifier per point below the minimum; this penalty reflects the difficulty they have in pulling the bow and nocking an arrow. Use the lowest value of your Strength, the bow’s rating, or the arrow Rating for range and damage when attacking a target, because your average Rating 10 titanium-sheathed beryllium-alloy bow tends to turn wood or fiberglass arrows into powder when they hit a target.",,,,,,,Core,Archery,93,,1
157,"Light Crossbow",Bow,7,4(m),-1,2,300¥,5P,"Modern crossbows are equipped with automatic reloading devices, so unless you’re using a museum piece, reloading doesn’t require a Ready Weapon action.",,,,,,,Core,Archery,93,,1
158,"Medium Crossbow",Bow,6,4(m),-2,4R,500¥,7P,"Modern crossbows are equipped with automatic reloading devices, so unless you’re using a museum piece, reloading doesn’t require a Ready Weapon action.",,,,,,,Core,Archery,93,,1
159,"Heavy Crossbow",Bow,5,4(m),-3,8R,"1,000¥",10P,"Modern crossbows are equipped with automatic reloading devices, so unless you’re using a museum piece, reloading doesn’t require a Ready Weapon action.",,,,,,,Core,Archery,93,,1
