Row,Name,Type,Accuracy,Ammo,ArmorPenetration,Availability,Cost,DamageValue,Description,Modes,Modifiers,Reach,RecoilCompensation,StandardUpgrades,Wireless,Source,Skill,SkillRow,Mounts,Container
64,"Winchester Model 2066",Shotgun,4,5(m),-1,4R,"1,000¥",11P,"Featured in the recent trid hit “Mad AIs at Dawn,” the Model 2066 is a development of a classic Winchester shotgun design, modernized for today’s sportsman, combined with a robot slayer. The receiver is constructed with high-tensile steel, improving the weapon’s ability to handle custom hunting loads, while the case-ejection system has been strengthened for shooters who prefer the modern, longer cartridges. The level-action has been designed with self-lubricating parts to ensure smooth operation and loading, which is a critical factor for those caught by surprise in wild country.",SS,,,,,,SR5:GH3,Longarms,101,"Top, Under, Barrel, Side, Internal, Stock",1
65,"Winchester Model 2054",Shotgun,"4 (5)",7(m),-1,6R,900¥,11P,"The Model 2054 is a semi-automatic design, originally submitted to the Ute Nation for possible use by their military police. The shotgun features an integral laser sight and retractable stock and can easily be upgraded with a smartgun system. While the Ute Nation ordered the first production runs, the shotgun was made available to civilian purchasers in 2056, after the initial military contract was completed.",SA,,,-1,"Laser Sight, Retractable Stock",,SR5:GH3,Longarms,101,"Top, Under, Barrel, Side, Internal, Stock",1
66,"Shiawase Arms Rain",Shotgun,4,5(ml),-1,4R,450¥,10P,"Shiawase’s latest entry into the civilian arms market, the Rain features the “Magazine Barrel” popular with many organizations, as it simplifies record keeping and maintenance as the barrel is replaced at the same time as the ammunition. The Rain currently has a number of different shot types available, with Matrix support recommendations based on the laws of your particular locale.",SA,,,-1,"Retractable Stock",,SR5:GH3,Longarms,101,"Top, Under, Barrel, Side, Internal, Stock",1
67,"Cavalier Falchion",Shotgun,"5 (7)",8(m),-1,9R,"1,200¥",12P,"Cavalier’s companion to the Sheriff, the Falchion is designed to be part of a shooter’s integrated Personal Area Network. The Falchion’s smartlink system painlessly synchronizes with the user’s commlink, providing visual cues when performing a weapon switch in a tactical situation. The advanced safety system and lack of manual controls ensures the weapon cannot be turned against its user. Also, in keeping with the Sheriff’s popular visual customization options, the Falchion is available in a number of different colors and decorative patterns.",SS,,,,"Advanced Safety, Melee Hardening, Smartlink, Trigger Removal",,SR5:GH3,Longarms,101,"Top, Under, Barrel, Side, Internal, Stock",1
68,"Ares Desert Strike","Sniper Rifle",7,14(c),-4,10F,"17,500¥",13P,"This combat-hardened sniper rifle is intended for long-range shooting in harsh environments. That means it was built without materials or technologies prone to failure. It comes equipped with a rigid stock with shock pad and a detachable imaging scope.",SA,"Rigid Stock with Shock Pad, TOP: Detachable Imaging Scope",,-1,,,Core,Longarms,101,"Top, Under, Barrel, Side, Internal, Stock",1
69,"Barret Model 122","Sniper Rifle",7(9),14(c),-6,20F,"38,500¥",14P,"The definitive anti-material rifle, Barret has been producing world-class firearms for decades, the Model 122 replaces the Model 121 as the company’s top-line offering. The rifle continues to be fitted with a sound suppressor, smartgun system and a folding bipod to help enhance long-range accuracy.",SA,,,-2,"Bipod, smartgun, sound suppressor",,SR5:R&G,Longarms,101,"Top, Under, Barrel, Side, Internal, Stock",1
70,"Cavalier Arms Crockett EBR","Sniper Rifle",6,20(c),-3,12F,"10,300¥",12P,"Straddling the line between assault rifle and sniper rifle, the Crockett EBR features a burst fire mode. While it lacks the magazine capacity of a true assault rifle, and lacks the precision of a true marksman’s weapon, it makes up for this in versatility, being able to switch fluidly between a sniping role and a combat role as easy as flipping a switch. It comes equipped with a rigid stock with shock pad and a detachable imaging scope.",SA/BF,"Rigid Stock with Shock Pad, TOP:Detachable Imaging Scope",,-1,,,Core,Longarms,101,"Top, Under, Barrel, Side, Internal, Stock",1
71,"Onotari JP-K50","Sniper Rifle",7,25(c),-3,13F,"12,500¥",12P,"The Onotari JP-K50 has an unusual past, being originally conceived for the next round of the Euro Wars, which never came about. Or at least, haven’t yet. It was shelved for decades, and only recently came back into the production queue during the so-called Dragon Civil War. Able to switch between long-range fire against a single hard armored target (such as a dragon) or firing bursts against clusters (such as drakes), it was seen as a weapon that could be issued to entire squads. Not mass produced, but produced enough that cost trumped quality in many ways, the final result is a sort of super-sized assault rifle rather than the kind of high-quality precision design that Saeder-Krupp is world famous for.",SA/BF,,,1,"Shock pad",,SR5:R&G,Longarms,101,"Top, Under, Barrel, Side, Internal, Stock",1
72,"Pioneer 60","Sniper Rifle",5,5(m),-1,2R,500¥,10P,"Morgan Boone’s been the face of the Kentucky Long Rifle Company for decades, and his Pioneer 60 is a household staple in rural areas across the CAS and UCAS even if his company refuses to sell it to anyone in the NAN. Simple but effective, it’s a rugged design that’s perfect for someone that just wants to get out of the house for a weekend of drinking beer and popping off a few rounds into the local fauna.",SA,,,,,,SR5:R&G,Longarms,101,"Top, Under, Barrel, Side, Internal, Stock",1
73,"Ranger Arms SM-5","Sniper Rifle",8,15(c),-5,16F,"28,000¥",14P,"A legendary assassin’s weapon, this sniper rifle features a silencer, an imaging scope, and a rigid stock with shock pad. The SM–5 disassembles completely in order to fit into a standard briefcase; setting it up or breaking it down takes an Extended Firearms + Logic [Mental] (6, Complex Action) Test. While deadly, the SM–5 is fragile. At the end of every Combat Turn in which the weapon is used in a running firefight, reduce its Accuracy by 1 (to a minimum of 3). If the weapon is used in combat as a melee weapon or to defend from a melee attack, reduce its Accuracy by 2 (again to a minimum of 3). Recalibrating the weapon (a one-hour job) returns its Accuracy to normal.",SA,"Silencer, Imaging Scope, Rigid Stock with Shock Pad",,-1,,,Core,Longarms,101,"Top, Under, Barrel, Side, Internal, Stock",1
74,"Remington 950","Sniper Rifle",7,5(m),-4,4R,"2,100¥",12P,"This high-powered bolt-action hunting rifle features classic wooden furniture and a top-mounted imaging scope that have kept it popular with hunters for several decades. It cannot mount underbarrel accessories.",SS,"TOP:Imaging Scope, UNDERBARREL:No Accessories Possible",,,,,Core,Longarms,101,"Top, Barrel, Side, Stock",1
75,"Ruger 100","Sniper Rifle",6,8(m),-3,4R,"1,300¥",11P,"This futuristic-looking gas-operated sporting rifle is the favorite weapon for many professional hunters and hobbyists. It features a built-in imaging scope and a rigid stock with shock pad.",SS,"Integrated Imaging Scope, Rigid Stock with Shock Pad",,-1,,,Core,Longarms,101,"Top, Under, Barrel, Side, Internal, Stock",1
76,"Terracotta ARMS AM-47","Sniper Rifle",7(9),18(c),-4,14F,"35,000¥",15P,"The AM-47 is a large sniper rifle, primarily intended for the larger metahuman species. The rifle features a number of advanced electronics to assist the shooter in destroying their target. The AM-47 is provided with an imaging scope, smartgun system, underbarrel weight, bipod, and a safe target system with an extended barrel for increased range over the competition.",SA,,,1(3),"Bipod, commlink (Device Rating 5), imaging scope (low-light vision, image link, vision magnification), smartgun",,SR5:R&G,Longarms,101,"Top, Under, Barrel, Side, Internal, Stock",1
77,AK-97,"Assault Rifle",4,38(c),-2,4R,950¥,10P,"The AK-97 is a legendary weapon with storied reliability—you can bury it for ten years, dig it up, and fire it immediately without a single problem. When all of the nano-fabricated AK–174s melted to slag, the AK-97s kept functioning just fine.",SA/BF/FA,,,,,,Core,Automatics,92,"Top, Under, Barrel, Side, Internal, Stock",1
78,AK-98,"Assault Rifle",5,38(c),-2,8F,"1,250¥",10P,"This rifle is an AK-97 with an integral under-barrel grenade launcher. Recently removed from the Russian inventory as it has largely been replaced by the AN-39, it is still being manufactured for export customers.",SA/BF/FA,,,,,,SR5:R&G,Automatics,92,"Top, Under, Barrel, Side, Internal, Stock",1
79,"AK-98 Grenade Launcher","Assault Rifle",3,6(m),,,,,,SS,,,,,,SR5:R&G,Automatics,92,"Top, Under, Barrel, Side, Internal, Stock",1
80,"Ares Alpha","Assault Rifle",5(7),42(c),-2,11F,"2,650¥",11P,"Specially designed for Ares Firewatch special forces, the Alpha has since become a multi-platinum best-selling success the world over, seeing use with UCAS Special Forces. In part, this is due to its exceptional brand awareness, and also because of its underbarrel grenade launcher, smartgun system, and an expensive chamber design that provides 2 points of Recoil Compensation.",SA/BF/FA,"UNDERBARREL:Grenade Launcher, SmartGun",,2,,,Core,Automatics,92,"Top, Under, Barrel, Side, Internal, Stock",1
81,"Ares Alpha Grenade Launcher","Assault Rifle",4(6),6(c),,,,Grenade,"Specially designed for Ares Firewatch special forces, the Alpha has since become a multi-platinum best-selling success the world over, seeing use with UCAS Special Forces. In part, this is due to its exceptional brand awareness, and also because of its underbarrel grenade launcher, smartgun system, and an expensive chamber design that provides 2 points of Recoil Compensation.",SS,"DV 4(6), Mode SS, Ammo 6©",,,,,Core,Automatics,92,"Top, Under, Barrel, Side, Internal, Stock",1
82,"Ares HVAR","Assault Rifle",5(7),50(c),,11F,"2,400¥",8P,"The longest continually produced member of Ares’ hyper velocity line, the HVAR is a complete small arms solution. It features an integral smartlink, a rigid stock with shock pad and a custom recoil reduction system, which is optimized for the weapon’s high rate of fire. Capable of accepting limited modification, the HVAR’s barrel is unable to support further additions.",SA/BF/FA,,,3(4),,,SR5:R&G,Automatics,92,"Top, Under, Barrel, Side, Internal, Stock",1
83,"Colt M23","Assault Rifle",4,40(c),-2,4R,550¥,9P,"This cheap, mass-produced, no-frills assault rifle is loved both by the gangbangers and pirates who can manage to get their hands on one and by the pros who are looking for something to modify from the ground up.",SA/BF/FA,,,,,,Core,Automatics,92,"Top, Under, Barrel, Side, Internal, Stock",1
84,"FN HAR","Assault Rifle",5(6),35(c),-2,8R,"1,500¥",10P,"This assault rifle is supremely popular with private security forces and corporate threat-response teams. It features a laser sight and a gas-vent 2 system.",SA/BF/FA,"Laser Sight, Gas-Vent (2)",,2,,,Core,Automatics,92,"Top, Under, Barrel, Side, Internal, Stock",1
85,"HK XM30, Assault Rifle","Assault Rifle",6(8),30(c),-2,15F,"4,500¥",9P,"The XM30 is H&K’s modular weapon system. Each kit comes with a shock-pad-equipped stock, smartgun system, imaging scope, two underbarrel secondary weapons, a secondary feed mechanism, and four different barrels along with a bipod for the heavy options. The XM30 is intended to equip entire military or police units with the ability to change roles based on the operational situation.",SA/BF/FA,,,-1,"Imaging scope, shock pad, smartlink",,SR5:R&G,Automatics,92,"Top, Under, Barrel, Side, Internal, Stock",1
86,"HK XM30, Carbine","Assault Rifle",6(8),30(c),-2,,,9P,"The XM30 is H&K’s modular weapon system. Each kit comes with a shock-pad-equipped stock, smartgun system, imaging scope, two underbarrel secondary weapons, a secondary feed mechanism, and four different barrels along with a bipod for the heavy options. The XM30 is intended to equip entire military or police units with the ability to change roles based on the operational situation.",SA/BF/FA,,,-1,"Imaging scope, shock pad, smartlink",,SR5:R&G,Automatics,92,"Top, Under, Barrel, Side, Internal, Stock",1
87,"HK XM30, Sniper","Assault Rifle",7(9),10(c),-2,,,9P,"The XM30 is H&K’s modular weapon system. Each kit comes with a shock-pad-equipped stock, smartgun system, imaging scope, two underbarrel secondary weapons, a secondary feed mechanism, and four different barrels along with a bipod for the heavy options. The XM30 is intended to equip entire military or police units with the ability to change roles based on the operational situation.",SA,,,2(3),"Imaging scope, shock pad, smartlink",,SR5:R&G,Automatics,92,"Top, Under, Barrel, Side, Internal, Stock",1
88,"HK XM30, LMG","Assault Rifle",6(8),100(belt),-2,,,9P,"The XM30 is H&K’s modular weapon system. Each kit comes with a shock-pad-equipped stock, smartgun system, imaging scope, two underbarrel secondary weapons, a secondary feed mechanism, and four different barrels along with a bipod for the heavy options. The XM30 is intended to equip entire military or police units with the ability to change roles based on the operational situation.",BF/FA,,,2(3),"Imaging scope, shock pad, smartlink",,SR5:R&G,Automatics,92,"Top, Under, Barrel, Side, Internal, Stock",1
89,"HK XM30, Shotgun","Assault Rifle",3(5),10(c),-1,,,10P,"The XM30 is H&K’s modular weapon system. Each kit comes with a shock-pad-equipped stock, smartgun system, imaging scope, two underbarrel secondary weapons, a secondary feed mechanism, and four different barrels along with a bipod for the heavy options. The XM30 is intended to equip entire military or police units with the ability to change roles based on the operational situation.",SA,,,-1,"Imaging scope, shock pad, smartlink",,SR5:R&G,Automatics,92,"Top, Under, Barrel, Side, Internal, Stock",1
90,"HK XM30, Grenade Launcher","Assault Rifle",4,6(c),,,,,"The XM30 is H&K’s modular weapon system. Each kit comes with a shock-pad-equipped stock, smartgun system, imaging scope, two underbarrel secondary weapons, a secondary feed mechanism, and four different barrels along with a bipod for the heavy options. The XM30 is intended to equip entire military or police units with the ability to change roles based on the operational situation.",SS,,,,"Imaging scope, shock pad, smartlink",,SR5:R&G,Automatics,92,"Top, Under, Barrel, Side, Internal, Stock",1
91,"Nissan Optimum II","Assault Rifle",5(7),30(c),-2,10F,"2,300¥",9P,"The standard weapon of the Imperial Japanese military, the Optimum II is getting a long in the tooth. The weapon gained mass-media fame with General Saito’s troop’s performance in San Francisco. It has a recoil-absorbing shock pad and a smartgun system.",SA/BF/FA,,,1,,,SR5:R&G,Automatics,92,"Top, Under, Barrel, Side, Internal, Stock",1
92,"Nissan Optimum II, Shotgun","Assault Rifle",4(6),5(m),-1,,,10P,"The standard weapon of the Imperial Japanese military, the Optimum II is getting a long in the tooth. The weapon gained mass-media fame with General Saito’s troop’s performance in San Francisco. It has a recoil-absorbing shock pad and a smartgun system.",SA,,,1,,,SR5:R&G,Automatics,92,"Top, Under, Barrel, Side, Internal, Stock",1
93,"Yamaha Raiden","Assault Rifle",6(8),60(c),-2,14F,"2,600¥",11P,"This electronic-firing assault rifle is state-of-the-art. The Raiden is very accurate and is quickly being adopted by japanacorp security forces and the Japanese Imperial Marines. It features an integral sound suppressor and smartgun system, and the electronic firing mechanism and design provides 1 point of Recoil Compensation.",BF/FA,"Sound Suppressor, SmartGun",,2,,,Core,Automatics,92,"Top, Under, Barrel, Side, Internal, Stock",1
94,"Shiawase Arms Monsoon","Assault Rifle",5,20(ml)x6,-1,10F,"1,900¥",10P,"The latest addition to Shiawase’s “Magazine Barrel” line, the Monsoon is a soldier’s dream, with the ammunition contained within the barrels. The Monsoon resists the environment’s harshest conditions and remains nearly maintenance free. As long as the user simply needs to ensure the barrels are not heavily plugged up and the bullets will fly toward their intended target, aided by the integral smartlink system, which is protected in its own shock-proof housing.",SA/FA,,,1,"Smartlink, Electronic Firing, Melee Hardening",,SR5:GH3,Automatics,92,"Top, Under, Barrel, Side, Internal, Stock",1
95,"Colt Inception","Assault Rifle","7 (8)",35(c),-1,11R,"2,250¥",10P,"Colt’s latest entry into the para-military market, the Inception replaces the venerable M23 and asserts Colt’s continued dominance in new this lucrative market segment. The Inception comes with an integral bipod for long-range engagements, which only serves to further amplify its exceptional accuracy. The titanium alloy, reinforced polymer frame can withstand the impacts beyond those typical of a service weapon and remain functional. The Inception is a new way forward for Colt, another reason to Trust the Legend™.",SA/BF,,,"1 (3)","Bipod, Electronic Firing, Laser Sight, Melee Hardening",,SR5:GH3,Automatics,92,"Top, Under, Barrel, Side, Internal, Stock",1
96,"Krupp Arms Kriegfaust","Assault Rifle",8,25(d),-1,10R,"1,300¥",9P,"A veteran of the Kilamanjaro cleansing, the Kriegfaust was designed to equip the larger members of a military command with a robust weapon suited to their needs. The drum magazine is better suited to larger hands and less likely to be dropped in high-adrenaline situations. The Kriegfaust also has a frame-mounted imaging scope, to ensure the shooter is able to get the maximum ballistic performance from the weapon’s large-caliber rounds.",SA/BF,,,1,"Metahuman Customization, Melee Hardening, Imaging Scope (w/ Vision Enhancement 1, Vision Magnification)",,SR5:GH3,Automatics,92,"Top, Under, Barrel, Side, Internal, Stock",1
97,SBD-44,"Assault Rifle",3,32(c),-1,4R,500¥,10P,"A footnote of Euro War history, the SBD-44 was a hastily constructed weapon developed to equip Germany’s equally hastily raised panzer grenadier units. Inspired by a weapon developed for equally desperate times and updated to fire modern ammunition, the SBd-44 was primarily constructed with a focus on quantity rather than the accuracy or quality typically associated with German manufactured items. The weapon was also rapidly phased out of production following the Alliance’s disintegration, making original production run versions rare today. Krupp still offers the weapon in their corporate security catalog, but no known orders have been processed in nearly twenty years.",SA/BF/FA,,,,Vintage,,SR5:GH3,Automatics,92,"Top, Under, Barrel, Side, Internal, Stock",1
98,"Ultimax Rain Forest Carbine","Assault Rifle",5,18(c),-2,8R,"2,800¥",11P,"The Ultimax Rain Forest is a short-barreled rifle designed to meet a design requirement for the Sumatran Alliance. The weapon met all of the government’s criteria and has been purchased to equip the constabulary. The Rain Forest features a deep magazine well to protect the magazine from the moisture and dirt common in jungle climates. Integrating night-vision technology, the carbine is well adapted to operations under the double and triple canopies frequently encountered by users. The carbine is available through Matrix purchases as well as local retailers.",SA/BF,,,-1,"Imaging Scope (w/ flare compensation, image link, low-light vision), Retractable Stock",,SR5:GH3,Automatics,92,"Top, Under, Barrel, Side, Internal, Stock",1
99,"Ares Executioner","Submachine Gun",4(6),30(c),,14F,"1,000¥",7P,"The Executioner is still the ultimate in concealable firepower for the executive protection professional. The weapon neatly fits down into a specially designed small briefcase, available in a number of different styles and colors (+400¥ per extra case). The weapon can be fired from the briefcase by pushing a concealed stud, or through the user’s PAN with smartlinked versions (+500¥). Recoil penalties are doubled when fired from the briefcase, but the surprise the Executioner provides may be enough to ensure survival. The Executioner also features an integral sound suppressor and an extendable stock for occasions when it is removed from its case.",SA/BF/FA,,,-1,"Folding stock, sound suppressor",,SR5:R&G,Automatics,92,"Top, Barrel, Side, Internal, Stock",1
100,"Colt Cobra TZ-120","Submachine Gun",4(5),32(c),,5R,660¥,7P,"With its unique design and wide range of accessories, the Colt Cobra series is quite popular both among security forces the world over and on the trids. The TZ–120 comes with a folding stock, top-mounted laser sight, and a barrel-mounted gas-vent 2 system.",SA/BF/FA,"Folding Stock, TOP:Laser Sight, BARREL:Gas Vent (2)",,2(3),,,Core,Automatics,92,"Top, Barrel, Side, Internal, Stock",1
101,"FN P93 Praetor","Submachine Gun",6,50(c),,11F,900¥,8P,"This bullpup submachine gun was purpose-built for Corporate Court-controlled Interpol fast-response teams. Its special chamber system provides 1 point of Recoil Compensation, it has an integrated rigid stock, and a flashlight that can be used to reduce darkness penalties by one step (Environmental Modifiers, p. 173). Possession of the FN P93 while not a legitimate member of a Corporate Court force is a crime in most jurisdictions.",SA/BF/FA,"Flashlight (one-step), Rigid Stock",,1(2),,,Core,Automatics,92,"Top, Barrel, Side, Internal, Stock",1
102,HK-227,"Submachine Gun",5(7),28(c),,8R,730¥,7P,"The SMG of choice for many corporate and military security forces, the HK–227 boasts a retractable stock, smartgun system, and integral sound suppressor.",SA/BF/FA,"SmartGun, Retractable Stock, Sound Suppressor",,-1,,,Core,Automatics,92,"Top, Barrel, Side, Internal, Stock",1
103,"HK Urban Combat","Submachine Gun",7(9),36(c),,16F,"2,300¥",8P,"HK continues to offer the Urban Combat as its high-end entry into the submachine gun market. The weapon is entirely constructed with non-metallic components and is not detectable with traditional MAD sensors. H&K has spared no expense in the weapon’s construction with an internal smartlink, a fixed sound suppressor, and a customized hydraulic recoil compensation system. The price of these bonuses is that the weapon is unable to accept further modifications.",SA/BF/FA,,,2,,,SR5:R&G,Automatics,92,"Top, Barrel, Side, Internal, Stock",1
104,"Ingram Smartgun X","Submachine Gun",4(6),32(c),,6R,800¥,8P,"Ingram Smartgun X: Grade-A bang bang. Famous as the weapon of choice for many legendary street samurai since the 2050s, the Ingram Smartgun comes tricked out with a gas-vent 2 system, a smartgun system, and an integral sound suppressor.",BF/FA,"Gas-Vent (2), SmartGun, Sound Suppressor",,2,,,Core,Automatics,92,"Top, Barrel, Side, Internal, Stock",1
105,"SCK Model 100","Submachine Gun",5(7),30(c),,6R,875¥,8P,"Shin Chou Kyogo is synonymous with Japanese corporate security. Nearly every Japana-corp’s security forces are issued the SCK 100, including Renraku’s infamous Red Samurai. The SCK 100 features an internal smartgun system and a folding stock.",SA/BF,"SmartGun, Folding Stock",,-1,,,Core,Automatics,92,"Top, Barrel, Side, Internal, Stock",1
106,"Uzi IV","Submachine Gun",4(5),24(c),,4R,450¥,7P,"This aging submachine gun is a worthy descendant of the famous Israeli weapon. The SMG features an integral folding stock and built-in top-mounted laser sight.",BF,"Folding Stock, TOP:Laser Sight",,-1,,,Core,Automatics,92,"Top, Barrel, Side, Internal, Stock",1
107,"Krime Spree","Submachine Gun",4,30(c),,6R,425¥,7P,"A new telescoping bolt design intended for those needing alternative ergonomics, the Spree is an economic choice for the discriminating shooter. The design is intended to allow for the easy mounting of a wide array of external aiming and tactical aids. While Krime does not currently manufacture such devices, a call to our friendly Customer Service department will provide a number of helpful suggestions based on the caller’s location.",FA,,,1,"Metahuman Adaptation",,SR5:GH3,Automatics,92,"Top, Barrel, Side, Internal, Stock",1
108,"Ares Sigma-3","Submachine Gun","4 (6)",50(d),,7R,"1,000¥",8P,"Ares has released their latest submachine gun design for law enforcement personnel worldwide. The Sigma-3’s unique drum magazine ensures operators have the ability to conduct a forced entry without having to worry about their ammunition supply at critical moments. The integral carrying handle/powered slide mount allows operators options beyond the internal smartlink, allowing optimization to meet tactical necessities. When using the collapsible stock, shooters have consistently exceeded organizational marksmanship standards, proving the quality design and manufacturing techniques.",SA/BF/FA,,,-2,"Collapsible Stock, Foregrip, Powered Slide Mount (Rating 2), Smartlink",,SR5:GH3,Automatics,92,"Top, Barrel, Side, Internal, Stock",1
109,"Cavalier Arms Gladius","Submachine Gun","3 (4)",32(c),,6R,400¥,7P,"A simple design intended for street officers requiring temporary increases in firepower, the Gladius combines modern electronics with an easy-to-maintain design. The weapon can also be used to equip a hastily raised militia; its simple operation and maintenance requirements make it ideal for citizen-soldiers. The stamped metal receiver is key to the weapon’s strength, while proprietary recoil absorbers ensure accuracy and the electronics package retains calibration.",BF/FA,,,1(2),"Collapsible Stock, Laser Sight",,SR5:GH3,Automatics,92,"Top, Barrel, Side, Internal, Stock",1
