Row,Name,Mount,Availability,Cost,Description,Wireless,Source,Bonus,MinRating,MaxRating,Attachable
41,"Safe Target System Base, Image Recognition Capabilities","Top, Under, Barrel, Side, Internal",8,300¥,"The goal of this system is to avoid those situations where your mates are chewing you out for accidentally shooting them in the hoop. Using information about your teammates’ appearance and the electronics in their PAN, this system attempts to recognize when you are aiming at any spot within 1 meter of a friendly target. In these situations, the system locks the trigger, preventing you from firing. Once the friendly target isn’t at risk anymore, you can start firing again. Note that the system interprets risk broadly—if there is something between you and a friendly target, the system will lock you out, unless that “something” is an entire office building or Mt. Rushmore or something.",,SR5:R&G,,1,1,1
42,"Safe Target System Base, Extra Image Profiles","Top, Under, Barrel, Side, Internal",8,"25¥ per 10 profiles","The goal of this system is to avoid those situations where your mates are chewing you out for accidentally shooting them in the hoop. Using information about your teammates’ appearance and the electronics in their PAN, this system attempts to recognize when you are aiming at any spot within 1 meter of a friendly target. In these situations, the system locks the trigger, preventing you from firing. Once the friendly target isn’t at risk anymore, you can start firing again. Note that the system interprets risk broadly—if there is something between you and a friendly target, the system will lock you out, unless that “something” is an entire office building or Mt. Rushmore or something.",,SR5:R&G,,1,1,1
43,"Slide Mount","Top, Under, Side",4,500¥,"By installing this on the top, underneath, or side slots, you can make it much easier to install and remove items in these locations. Items may be taken on or off using a Simple Action.",,SR5:R&G,,1,1,1
44,Sling,,,15¥,"For Special Forces troops, this is a sturdy piece of mesh or canvas custom-fitted to the user and positioned on the weapon in a way to ensure it can be readied as quickly as possible. For guerilla warriors, this might be a piece of rope, and old belt, or anything else that can be rigged up to help them keep from dropping their weapon. No matter how complex or simple, the function is basic—it makes sure your weapon doesn’t fall to the ground when you’re running or diving from an explosion or in the middle of being shot or whatever. It may be shot out of your hands, but getting it ready again is a Simple Action. The sling does not take up any slots on a weapon.",,SR5:R&G,,1,1,0
45,Tracker,,4,150¥,"This is a customized RFID tag that combines the functions of security and stealth RFIDs, giving you the chance to track down your weapon if for some reason you don’t know where it is. Use the rules for RFID tags, p. 440, SR5; assume the tracker has the function of a security tag and a stealth tag. The tracker does not take up any slots in a weapon.",,SR5:R&G,,1,1,0
46,"Bola Launcher",Under,8R,350¥,"Would your weapon be enhanced by the ability to throw out two balls connected by a thin rope that can entangle and trip up your opponent? If your answer is “no,” please go back and read the questions again. As the name indicates, this goes on the underneath slot, and it can only go on weapons rifle-sized or larger The launched bola works in the same way as a regular bola (p. 27) as thrown by someone with Strength 5. It uses Heavy Pistol ranges, and wielders fire it with the Exotic Ranged Weapon (Bola) skill.",,SR5:R&G,,1,1,1
47,Chainsaw,Under,10R,"500¥ + chainsaw","Very useful in case you need to chop wood for a campfire while out on a run, or cut some lumber to repair floorboards.",,SR5:R&G,,1,1,1
48,Flamethrower,Under,"As Flamethrower + 2","200¥ + flamethrower","We’ve known runners so fond of fire that they might mount one of these on an actual flamethrower. This can go on the underbarrel slot of a rifle-sized weapon. For rules covering flamethrower use, see p. 49.",,SR5:R&G,,1,1,1
49,"Grapple Gun",Under,8R,600¥,"It’s a grapple gun mounted on the underneath slot of a rifle-sized weapon or larger. No muss, no fuss. For grapple gun rules, see p. 449, SR5.",,SR5:R&G,,1,1,1
50,"Grenade Launcher",Under,10F,"3,500¥","Give yourself the ability to lob grenades out there with your weapon. It can be mounted (say it with us now!) on the underneath slot of a rifle-sized weapon or larger. See p. 434, SR5, for more information on using grenade launchers.",,SR5:R&G,,1,1,1
51,Weight,Under,,¥,"It may be a crude way to reduce recoil, but it still works. By placing some weight in the underneath slot of a weapon, you prevent the kick from being as severe as it would be otherwise. This provides 1 point of recoil compensation when using the weapon in Full Auto mode.",,SR5:R&G,,1,1,1
52,"Weapon Commlink",,"As Commlink","200¥ + Commlink","Once you get over the idea that using your commlink means touching it all the time, placing one in your weapon becomes a sensible move. Your weapon becomes the heart of your PAN. Many users like to use this with the weapon personality mod.",,SR5:R&G,,1,1,0
53,"Weapon Personality",,8,250¥,"Does your gun need its own software complete with an artificial per sonality to provide information in a more chatty fashion instead of just providing numbers, crosshairs, and other similar data? Depends on how you function. If meta-to-meta interaction is how you prefer to get your information, you might want a weapon personality, which provides a metahuman-like interface so you can chat away. The guttural Neil the Ork Barbarian with its "scalped 'em" grunt to tell you when you got a hit is especially popular.",,SR5:R&G,,1,1,0
54,"Ammo Skip System",Under,8R,250¥,"This modifcation is made specifcally for shooters who want to use multiple types of ammo and have them ready to fire at a moment’s notice. This mod can be applied to any weapon with a cylinder or drum magazine. As a Simple Action the system rotates the cylinder or drum to the chamber holding rounds of the wielder’s choice. Wireless bonus: Switching between ammo types is a free action.",,SR5:HT,,1,1,1
